{
  "workflow_id": "decision-option-agent-nodes-20260821",
  "task_size": "medium",
  "context_budget": "medium_context",
  "model_provider": "openai",
  "model_name": "runtime-configured",
  "agent_id": "project-execution-agent",
  "phase": "validation",
  "input_tokens": 0,
  "output_tokens": 0,
  "cached_input_tokens": 0,
  "reasoning_tokens": 0,
  "tool_calls_count": 0,
  "files_read_count": 12,
  "files_modified_count": 15,
  "memory_queries_count": 0,
  "graph_queries_count": 0,
  "estimated_cost": 0,
  "currency": "USD",
  "published_at": "2026-08-21T13:30:06Z",
  "source": "unavailable",
  "token_saving_decisions": [
    "Exact provider token usage was unavailable; zero values are not measured usage.",
    "Reused the shared application decision summary instead of separately reconstructing ledger and source alternatives in every renderer.",
    "Ran focused model tests, the 114-test frontend suite, and a production build without rebuilding the project graph."
  ]
}
