{
  "workflow_id": "application-delivery-timeline-20260821",
  "task_size": "medium",
  "context_budget": "medium_context",
  "model_provider": "openai",
  "model_name": "runtime-configured",
  "agent_id": "project-execution-agent",
  "phase": "validation",
  "input_tokens": 0,
  "output_tokens": 0,
  "cached_input_tokens": 0,
  "reasoning_tokens": 0,
  "tool_calls_count": 0,
  "files_read_count": 11,
  "files_modified_count": 9,
  "memory_queries_count": 0,
  "graph_queries_count": 0,
  "estimated_cost": 0,
  "currency": "USD",
  "published_at": "2026-08-21T11:07:40Z",
  "source": "unavailable",
  "token_saving_decisions": [
    "Exact provider token usage was unavailable; zero values are not measured usage.",
    "Reused the project-instruction ledger and exact file/scope matching instead of inventing functionality history.",
    "Ran 105 frontend tests, one production frontend build, and an independent read-only review."
  ]
}
