{
  "workflow_id": "application-build-event-decision-graph-20260821",
  "task_size": "medium",
  "context_budget": "medium_context",
  "model_provider": "openai",
  "model_name": "runtime-configured",
  "agent_id": "project-execution-agent",
  "phase": "validation",
  "input_tokens": 0,
  "output_tokens": 0,
  "cached_input_tokens": 0,
  "reasoning_tokens": 0,
  "tool_calls_count": 0,
  "files_read_count": 10,
  "files_modified_count": 8,
  "memory_queries_count": 0,
  "graph_queries_count": 0,
  "estimated_cost": 0,
  "currency": "USD",
  "published_at": "2026-08-21T16:33:47Z",
  "source": "unavailable",
  "token_saving_decisions": [
    "Exact provider token usage was unavailable; zero values are not measured usage.",
    "Reused the normalized build-event/decision contract and exact topology associations instead of deriving links from labels.",
    "Ran focused model tests, the 117-test frontend suite, a production build, and independent review without regenerating global topology."
  ]
}
